{
  "contract": {
    "id": "workspai.graph.proposed-change-set",
    "version": "0.1.0-candidate"
  },
  "id": "proposal:overlay:fixture",
  "baseGeneration": "generation:base",
  "inputs": [
    {
      "kind": "edited",
      "locator": "src/index.ts",
      "inputKind": "source-file",
      "scanProfileDigest": {
        "algorithm": "sha256",
        "value": "aaaaaaaaaaaaaaaaaaaaaaaaaaaaaaaaaaaaaaaaaaaaaaaaaaaaaaaaaaaaaaaa"
      },
      "priorDigest": {
        "algorithm": "sha256",
        "value": "cccccccccccccccccccccccccccccccccccccccccccccccccccccccccccccccc"
      },
      "nextDigest": {
        "algorithm": "sha256",
        "value": "8888888888888888888888888888888888888888888888888888888888888888"
      }
    }
  ],
  "causes": [{ "kind": "content", "source": "content-state-comparison" }],
  "proposal": {
    "kind": "patch",
    "identity": "patch:fixture:1",
    "digest": "9999999999999999999999999999999999999999999999999999999999999999"
  },
  "assumptions": ["providers-not-re-executed"]
}
